product_name,description,image1,price2,link2,price1,link1
傘袋 PIT UP 長傘用 200枚 CW-0028【業務用 雨傘ふくろ カサ入れ 縦長ビニール袋 かさ袋 カサ袋 ポリ袋 濡れた傘 傘ビニール袋 傘用袋 水濡れ対策 水滴 アンブレラ 商業施設】,【送料無料】傘袋 縦長 たてなが たて長 ビニール傘袋,https://thumbnail.image.rakuten.co.jp/@0_mall/masayosiryouhin/cabinet/08891907/dj-pituptan_00.jpg?_ex=128x128,,,680.0,https://item.rakuten.co.jp/masayosiryouhin/dj-pituptan/
TANOSEE　かさ袋（エコノミー）　1セット（6000枚：200枚×30パック） 【送料無料】,傘袋ならコレ！スタンダードタイプ。　,https://thumbnail.image.rakuten.co.jp/@0_mall/p-tano/cabinet/shohin900_04/966-2483.jpg?_ex=128x128,,,6435.0,https://item.rakuten.co.jp/p-tano/966-2483/
折りたたみ傘袋 マイクロファイバー超吸水傘ポーチ 2面超吸水 傘ケース 携帯 便利 収納バッグ ペットボトルカバー 折り畳み傘袋 男女兼用,撥水性が良く中身の生地はやわらかい素材を採用して、傘自体の水分を吸ってくれます。,https://thumbnail.image.rakuten.co.jp/@0_mall/umbrelland/cabinet/2019/umbag-101-sr.jpg?_ex=128x128,,,890.0,https://item.rakuten.co.jp/umbrelland/umbag-101/
"【楽天1位受賞 累計販売3,200枚】 超吸水 マイクロファイバー 大サイズ 40cm 傘カバー 傘 カバー 傘袋 折りたたみ傘 ケース 吸水 傘ケース 傘袋 折り畳み傘 ケース おりたたみ傘 カバー 折り畳み傘カバー 送料無料",傘カバー 傘 カバー 傘袋 折りたたみ傘 ケース 吸水 傘ケース 傘袋 折りたたみ傘ケース マルチカバー ペットボトル 水筒 メンズ レディース 傘ケース 吸水 マイクロファイバー 福袋,https://thumbnail.image.rakuten.co.jp/@0_mall/lebenwood/cabinet/08503648/08659515/08689854/1.jpg?_ex=128x128,,,1280.0,https://item.rakuten.co.jp/lebenwood/10004378/
傘袋　UB-1(1〜2本用)　かさケース　傘入れ　傘用ビニール　梅雨対策,&#9730;雨の日の必需品、傘袋&#9730;,https://thumbnail.image.rakuten.co.jp/@0_mall/atta-v/cabinet/03699559/img61047338.jpg?_ex=128x128,,,682.0,https://item.rakuten.co.jp/atta-v/10000554/
《10%OFFクーポン発行!!》【楽天1位!!】 折りたたみ傘 ケース 傘ケース 吸水 ユニセックス 傘カバー 超吸水 マイクロファイバー 折りたたみ傘用 4サイズ 2面吸水 かさ 傘 折り畳み式 折り畳み傘 メンズ レディース 送料無料 プレゼント,【送料無料】濡れた傘の水分を2面から包み込み水分をさっと吸水！,https://thumbnail.image.rakuten.co.jp/@0_mall/mujina/cabinet/category04/mj-1008_1.jpg?_ex=128x128,,,1390.0,https://item.rakuten.co.jp/mujina/mj-1008/
KN-100 1冊あたり136円 100枚x60冊 ひも付きかさ袋 0.012mm厚 半透明/傘袋 カサ袋 ひもつき エコ袋 袋 使い捨て 業務用 サンキョウプラテック 送料無料 あす楽 即納 即日発送,【雨の日の必須アイテム】,https://thumbnail.image.rakuten.co.jp/@0_mall/poly-stadium/cabinet/07591434/kn-100/kn-100.jpg?_ex=128x128,,,8160.0,https://item.rakuten.co.jp/poly-stadium/kn-100/
【即発送】 SuSu ロングタイプ 長傘用 傘ケース 【ストライプ BK】 超吸収マイクロファイバー 傘 ケース スウスウ (傘カバー・傘袋・傘収納袋)【配送方法：ゆうパケット2】,【全国送料無料】 これで電車も安心！傘ケース（傘収納）,https://thumbnail.image.rakuten.co.jp/@0_mall/kaimin-rs/cabinet/0c/susu-stbk-1.jpg?_ex=128x128,,,1798.0,https://item.rakuten.co.jp/kaimin-rs/6355-137_0c/
傘袋　UB-2(1〜2本用)　レモン・グリーン・ブルー・ブラウン・サーモン・グレー　かさケース　傘入れ　傘用ビニール　梅雨対策,&#9730;雨の日の必需品、傘袋&#9730;,https://thumbnail.image.rakuten.co.jp/@0_mall/atta-v/cabinet/04604351/imgrc0064171061.jpg?_ex=128x128,,,682.0,https://item.rakuten.co.jp/atta-v/10000556/
【ポリ袋】傘袋GU05(外袋有・半透明) 100枚入,傘が一本入る使い捨てかさ袋。半透明（HDPE）・外袋有りタイプ！,https://thumbnail.image.rakuten.co.jp/@0_mall/morofuji/cabinet/shohin/kiseihin/amagu/imgrc0070513332.jpg?_ex=128x128,,,157.0,https://item.rakuten.co.jp/morofuji/10201055-1/
【店内全品5％引き】お買い物マラソン 傘ホルダー 傘立て アンブレラケース 傘 雨傘 ケース カバー バッグ 防水 マリンブルー カナロア ウェットスーツ素材 かわいい 汎用 洗える パラソル 日傘 雨 梅雨 レイングッズ かんたん 収納 車 カー シート CARESTAR メール便可,【水洗いOK】おしゃれなアンブレラケース！雨傘もバッグに入れて持ち運び♪,https://thumbnail.image.rakuten.co.jp/@0_mall/cars-z-style/cabinet/kanaloa/pastel/zbkw-ubc4-13.jpg?_ex=128x128,,,1400.0,https://item.rakuten.co.jp/cars-z-style/zbkw-ubc4/
折りたたみ傘 カバー ポーチ | プチギフト おしゃれ ちょっとした プレゼント ギフト 女性 レディース 雑貨 ブランド ケース 吸水 マイクロファイバー かわいい 傘カバー 傘袋 傘ケース 折り畳み 収納 傘入れ 傘収納袋 アクセサリー 退職 お礼 バッグイン,折りたたみ傘 カバー Shizuku light,https://thumbnail.image.rakuten.co.jp/@0_mall/prairiedog/cabinet/szkl/c/szkl-c_00.jpg?_ex=128x128,,,1320.0,https://item.rakuten.co.jp/prairiedog/szkl-c/
[ポスト投函送料無料] 二本用傘袋【紺】超撥水　収納袋付き！折りたたみ傘にも対応！【お受験用品の店●エレガンテ・ポポ】,お受験・学校説明会・学校訪問などに便利な傘ケース電車通勤も安心,https://thumbnail.image.rakuten.co.jp/@0_mall/elegante-popo/cabinet/thum/p_ks-003.jpg?_ex=128x128,,,3044.0,https://item.rakuten.co.jp/elegante-popo/ks-003/
「カウコレ」プレミアム 出し入れしやすい傘袋200枚入り×10,★商品合計金額3000円(税込)以上送料無料★,https://thumbnail.image.rakuten.co.jp/@0_mall/kaumall/cabinet/500_326/c0355231sl.jpg?_ex=128x128,,,4576.0,https://item.rakuten.co.jp/kaumall/42866725/
送料無料 ( 規格内 ) 折りたたみ傘用 収納ポーチ 濡れた傘をサッと収納！超吸水マイクロファイバー製 ファスナー バッグの中が濡れない【 折り畳み傘 傘ケース 傘袋 便利グッズ 雨具 吸水 梅雨対策 】 送料込 ◎ ◇ 傘カバー,本日楽天カードでのお買い物でポイント5倍！さらに24時間限定！2点以上のご購入でお得な10%OFFクーポン！,https://thumbnail.image.rakuten.co.jp/@0_mall/s-plaza/cabinet/w1/w3/imgrc0072266004.jpg?_ex=128x128,,,495.0,https://item.rakuten.co.jp/s-plaza/10004536/
TANOSEE　かさ袋（エコノミー）　1セット（1000枚：200枚×5パック）,傘袋ならコレ！スタンダードタイプ。　,https://thumbnail.image.rakuten.co.jp/@0_mall/p-tano/cabinet/shohin900_08/966-2476.jpg?_ex=128x128,,,1193.0,https://item.rakuten.co.jp/p-tano/966-2476/
大型 傘ケース 傘袋 折りたたみ傘用 マイクロファイバー カバー 超吸水 ロングカバー 32cmまでOK 2面吸水 折り畳み 傘袋 軽量 携帯便利 梅雨 雨 雪 防水 極太 【送料無料】,折りたたんだ状態で32cmまでの傘であれば、ケース内に収納が可能です。カバンの中に傘を収納しても書類などが濡れてしまう心配がなくなります。,https://thumbnail.image.rakuten.co.jp/@0_mall/porto3/cabinet/compass1671198814.jpg?_ex=128x128,,,1210.0,https://item.rakuten.co.jp/porto3/umbrella-006/
【Rose Blanc 傘袋】 3段50cm 折りたたみ傘用 傘袋 専用傘袋 2WAY コンビタイプ,【ゆうパケット対応】お手持ちの日傘や傘袋を失くしてまったり破損してしまっても安心♪傘袋 カバー 傘バッグ ケース,https://thumbnail.image.rakuten.co.jp/@0_mall/roseblanc/cabinet/kasa20/3cb-pb-top.jpg?_ex=128x128,,,2200.0,https://item.rakuten.co.jp/roseblanc/3cb-pb/
ギフト対象【Wpc.公式】WbyWpc. ビジネスアンブレラケース【おしゃれ ユニセックス 男女兼用 メンズ 男性 レディース 女性 防水 撥水 折りたたみ傘袋 無地 シンプル 通勤 通学 吸水素材 ペットボトルカバー】,折りたたみ傘用 収納袋 キャリーケース・バッグに取り付け可能 黒 ネイビー お誕生日プレゼント プチギフト 男友達 彼氏 お父さん おじいちゃん 祖父 スタイリッシュ カジュアル,https://thumbnail.image.rakuten.co.jp/@0_mall/wpc-worldparty/cabinet/item/2022/wpc_goods/w048_01a.jpg?_ex=128x128,,,2200.0,https://item.rakuten.co.jp/wpc-worldparty/w048/
フルトン 傘袋 傘カバー 吸水 23-152-13149-02 FULTON | サイズ調節可能 長傘 折りたたみ傘 傘入れ 吸湿速乾[即日発送][DL10],3980円以上購入で送料無料 あす楽,https://thumbnail.image.rakuten.co.jp/@0_mall/sacs-bar/cabinet/fulton/23-152-13149-02.jpg?_ex=128x128,,,2530.0,https://item.rakuten.co.jp/sacs-bar/23-152-13149-02/
ストレージバッグ 傘バッグ 傘小物 傘袋 傘入れ 保管 持ち運び 傘 日傘 「 ナチュラル＆宝相華プリント ストレージバッグ 」 傘 日傘 長傘 撥水,ストレージバッグ 傘バッグ 傘小物 傘袋 傘入れ 保管 持ち運び 傘 日傘 長傘 長傘 撥水,https://thumbnail.image.rakuten.co.jp/@0_mall/c-modern1/cabinet/ps2022/psb220401_01.jpg?_ex=128x128,,,1320.0,https://item.rakuten.co.jp/c-modern1/psb220401/
【メール便送料無料】 【即納】 長傘用 傘カバー 68cm 肩掛けタイプ ブラック【傘カバーのみ】無地 ロング傘 吸水 傘専用 カバー 収納ケース 袋 カバー レディース メンズ 男女兼用 長傘ロングタイプ 傘ケース 傘袋,長傘 肩掛け用 収納 かさ カサ 大人 通勤 通学 濡れない 傘入れ,https://thumbnail.image.rakuten.co.jp/@0_mall/nopnop/cabinet/sho/sho-kasabukuro-m.jpg?_ex=128x128,,,800.0,https://item.rakuten.co.jp/nopnop/sho-kasabukuro/
二本用傘袋【紺】超撥水　収納袋付き！折りたたみ傘にも対応！日本製【お受験用品の店●ハッピークローバー】【あす楽対応商品】,お受験・学校説明会・学校訪問などに便利な傘ケース電車通勤も安心,https://thumbnail.image.rakuten.co.jp/@0_mall/happyclover/cabinet/thum/h_ks-003.jpg?_ex=128x128,,,2960.0,https://item.rakuten.co.jp/happyclover/ks-003/
折り畳み傘ケース 傘カバー 防水ファスナー 超吸水 2面超吸水 3サイズ 2色 傘ケース 傘入れ 傘袋 梅雨対策 吸水力抜群 軽量 携帯便利 かさ 傘 折り畳み傘 メンズ レディース,折り畳み傘ケース 傘カバー 防水ファスナー 超吸水 2面超吸水 3サイズ 2色 傘ケース 傘入れ 傘袋 梅雨対策 吸水力抜群 軽量 携帯便利 かさ 傘 折 送料無料,https://thumbnail.image.rakuten.co.jp/@0_gold/e-finds-ada/cabinet/c03-46a_1.jpg?_ex=128x128,,,990.0,https://item.rakuten.co.jp/e-finds-ada/c03-46a/
ソロツーリスト 長傘 ケース 肩掛けストラップ付き 傘 袋 レイン カバー 収納 ポーチ カサケース solo-tourist NEWアンブレラケース UC-N ブラック 3点迄メール便OK(va0a098),レビュー記入で特典進呈♪　傘の水滴から大事な衣服を守ります！＊旅行用品/旅行便利グッズ/海外旅行/傘/収納ケース/傘袋/黒/撥水/防水/レイングッズ/ギフト/雨具/傘カバー/梅雨＊,https://thumbnail.image.rakuten.co.jp/@0_mall/griptone/cabinet/shohin13/va0a098_01.jpg?_ex=128x128,,,1540.0,https://item.rakuten.co.jp/griptone/va0a098/
かさ袋ハンガー用 かさ袋(小) UB-2 / えいむ かさ 傘 ハンガー 立て かさ立て,業務用飲食店用品 傘ハンガー・傘立て,https://thumbnail.image.rakuten.co.jp/@0_mall/sutekimenu/cabinet/a5400/5122.jpg?_ex=128x128,,,667.0,https://item.rakuten.co.jp/sutekimenu/5122/
クニルプス ドライバッグ【メール便送料無料】折りたたみ傘 収納袋 折りたたみ傘袋 濡れたまま DRY BAG ドライバック 傘ケース 折り畳み傘専用収納袋 ブランド 濡れた傘を収納 便利 おしゃれ 傘カバー ドライバック 正規店【ポイント10倍 送料無料】［ Knirps Dry Bag ］,雨にぬれた折りたたみ傘を持ち歩くのに便利なドライバッグ！電車やバスの混雑の中で、周りを気にせず濡れた傘を携帯できます。,https://thumbnail.image.rakuten.co.jp/@0_mall/roomy/cabinet/500cart_all/500cart_11g/p10-3/imo1010-lq009-0_gt01.jpg?_ex=128x128,,,2090.0,https://item.rakuten.co.jp/roomy/imo18mar27h04/
傘ケース マイクロファイバー 通販 おしゃれ かわいい レディース メンズ ブランド mabu マブ シンプル デザイン 大きめ ダブルファスナー ポケット付き ボーダー ストライプ トライアングル チェリー チェック 傘袋,傘ケース マイクロファイバー 通販 おしゃれ かわいい レディース メンズ ブランド mabu マブ シンプル デザイン 大きめ ダブルファスナー ポケット付き ボーダー ストライプ,https://thumbnail.image.rakuten.co.jp/@0_mall/backyard/cabinet/main04/mabupouch.jpg?_ex=128x128,,,1320.0,https://item.rakuten.co.jp/backyard/mabupouch/
折りたたみ傘 ケース 吸水 かわいい 手提げ付き 吸水ポーチ くるポン ウォーターカラー ボトルカバー ボトルケース 水筒カバー 水筒ケース ペットボトルホルダー 防水 カサ カバー ヒモ付き カバー 収納 携帯 リコーダーケース,【メーカー直販】手提げを取外しできる便利なフック付き＊ポーチのみで傘は付いていません,https://thumbnail.image.rakuten.co.jp/@0_mall/aile2016/cabinet/kurupon/ok-031-035.jpg?_ex=128x128,,,1320.0,https://item.rakuten.co.jp/aile2016/ok-031-035/
傘袋スタンドUB-288-000-0 〜テラモト〜『傘袋スタンド』（袋別売り）,ゴミ入れ付で使い勝手のいい傘袋スタンド,https://thumbnail.image.rakuten.co.jp/@0_mall/arotho/cabinet/teramoto2/ksd.jpg?_ex=128x128,,,15800.0,https://item.rakuten.co.jp/arotho/kasasd/
