product_name,description,image1,price2,link2,price1,link1
【10％OFFクーポン★10日まで】 天然アロマ コンパクト アロマディフューザー アロミックミニ (本体+専用オイル70ml) 全8種類｜ルームフレグランス 芳香剤 アロマ ディフューザー 水なし 消臭 リラックス ホワイトデー ギフト プレゼント アロミックスタイル,コードレス 気化式 消臭・芳香剤 置き型 精油 玄関 トイレ 部屋 寝室 リビング 安眠グッズ おしゃれ アロミック・ミニ アロミック ミニ aromic mini アロマスター aromic style,https://thumbnail.image.rakuten.co.jp/@0_mall/aromaspray/cabinet/item/aromic-mini-c.jpg?_ex=128x128,,,1990.0,https://item.rakuten.co.jp/aromaspray/minif/
専用オイル アロミックミニ 詰め替え 70ml【交換パッド付き】全8種類｜ アロミックミニオイル リフィル 詰替 中身 アロマオイル アロマ 天然アロマ コンパクト アロマディフューザー ルームフレグランス 芳香剤 玄関 玄関用 トイレ 部屋 部屋用 リビング アロミックスタイル,消臭 消臭・芳香剤 水を使わない フレグランス リラックス 安眠 癒し 精油 アロミック・ミニ アロミック ミニ aromic mini アロマスター aromic style,https://thumbnail.image.rakuten.co.jp/@0_mall/aromaspray/cabinet/item/minif-e_01.jpg?_ex=128x128,,,1090.0,https://item.rakuten.co.jp/aromaspray/minif-e/
【詰め替え まとめ買い】 天然 アロマスプレー グレープフルーツ 3点セット(100ml詰替用×3) | 精油 アロマ スプレー エコパック つめかえ 詰め替え用 リフィル ルームフレグランス ルームスプレー ピローミスト 香水 柑橘 柑橘系 消臭 芳香剤 消臭剤 アロミックスタイル,車 マスク 消臭スプレー 除菌スプレー フレグランスミスト ファブリックミスト 消臭・芳香剤 部屋 玄関 トイレ 衣類 エッセンシャルオイル アロマオイル アロマスター aromic style,https://thumbnail.image.rakuten.co.jp/@0_mall/aromaspray/cabinet/item/sp-gf100ex3-01.jpg?_ex=128x128,,,1790.0,https://item.rakuten.co.jp/aromaspray/grapfruit_100_eco3/
クリーンエアーエアー エアミスト セット 50ml x 3本 空気ケア ティートリー ユーカリ アロマスプレー ルームミスト 天然アロマ @aroma クリーンエアー ストレスケア 空気清浄 お試し ギフト 公式 セール中 セール対象 アットアロマ @aroma,,https://thumbnail.image.rakuten.co.jp/@0_mall/ataroma/cabinet/fuku/cmist_set_720.jpg?_ex=128x128,,,4620.0,https://item.rakuten.co.jp/ataroma/10000577/
【ポイント消化】 アロマセット アロマ エッセンシャルオイル 選べる 各5ml×3本 お試し 精油 ブレンドアロマ 天然アロマ ブレンドオイル ブレンド精油 アロマエッセンス 女性 プレゼント ラベンダー オレンジ ユーカリ ゼラニウム ローズマリー お試しセット 天然 送料無料,オーダー後に注入 天然100％の良品オイルをプロがブレンドしてボトルからそのまま絶妙ブレンドアロマが滴下 ポスト投函で商品受取り安心 国産ボトルと中栓で高品質にこだわり,https://thumbnail.image.rakuten.co.jp/@0_mall/season-aroma-labo/cabinet/imgrc0082082041.jpg?_ex=128x128,,,2200.0,https://item.rakuten.co.jp/season-aroma-labo/ko3s/
【最大15%OFFクーポン】生活の木 空間消臭アロマ ハウスアロマ 30ml 天然 エッセンシャルオイル 天然アロマ 消臭オイル アロマオイル 消臭効果 オレンジハーブ シトラスミント フローラル ハーバルグリーン 玄関 リビング,生活空間に漂う悪臭を軽減し、心地よい香りに。生活の木 空間消臭アロマ ハウスアロマ 10ml 天然 エッセンシャルオイル オレンジハーブ シトラスミント フローラル ハーバルグリーン,https://thumbnail.image.rakuten.co.jp/@0_mall/aimere/cabinet/00276351/imgrc0120288749.jpg?_ex=128x128,,,3520.0,https://item.rakuten.co.jp/aimere/s0070220/
【クーポン配布中 10日まで】天然アロマ お試しセット アロマスプレー 選べる3点セット(15ml×3) 1000円ポッキリ | アロマ マスク スプレー 携帯 リラックス 安眠グッズ 精油 ラベンダー ベルガモット 香水 ギフト プレゼント プチギフト 消臭 アロミックスタイル,【おひとり様1セット限り】【メール便 送料無料】寝室 ピローミスト ルームフレグランス 除菌 ラベンダー ベルガモット 柑橘系 ぽっきり 1000円 ポッキリ アロマスター aromic style,https://thumbnail.image.rakuten.co.jp/@0_mall/aromaspray/cabinet/item/trialset_3-new.jpg?_ex=128x128,,,1000.0,https://item.rakuten.co.jp/aromaspray/trialset_3/
天然アロマ 吊り下げ アロマディフューザー アロミックハング (専用オイル50ml入り) 6種類×2色 | アロマ ディフューザー 水なし 気化式 玄関 トイレ 部屋 寝室 クローゼット 消臭 リラックス 虫除け 虫よけ 防虫 芳香剤 消臭剤 アロミックスタイル,つるし型 ハンギング 消臭 消臭・芳香剤 水を使わない フレグランス リラックス 安眠 癒し 精油 アロミック・ハング アロミック ハング aromic hang アロマスター aromic style,https://thumbnail.image.rakuten.co.jp/@0_mall/aromaspray/cabinet/item/aromic-hang-01.jpg?_ex=128x128,,,1490.0,https://item.rakuten.co.jp/aromaspray/aromic-hang/
【20％OFF！＆ポイント5倍 お買い物マラソン】sVEAS スクアレンシャンプー アミノ酸系 スカルプケア 頭皮ケア 年齢髪 ノンシリコン エイジングケア 天然アロマ ボタニカル 無添加 敏感肌 スクワレン トコトリエノール スクワラン オールインワン ハリ コシ サラツヤ 大容量,美しい髪は健康な頭皮からエスヴィアス,https://thumbnail.image.rakuten.co.jp/@0_mall/sveas/cabinet/01/compass1669358959.jpg?_ex=128x128,,,4480.0,https://item.rakuten.co.jp/sveas/s-01fashionsale/
【20％OFF！＆ポイント5倍 お買い物マラソン】sVEAS スクアレンシャンプー&スクアレントリートメント アミノ酸 スカルプケア ノンシリコン エイジングケア 天然アロマ ボタニカル 無添加 敏感肌 スクワレン トコトリエノール スクワラン オールインワン ツヤ ハリコシ 大容量,美しい髪は健康な頭皮からエスヴィアス,https://thumbnail.image.rakuten.co.jp/@0_mall/sveas/cabinet/01/compass1668071298.jpg?_ex=128x128,,,8800.0,https://item.rakuten.co.jp/sveas/set-01fashionsale/
【3セット】愛の不時着 天然アロマ マスクシール マスクパッチ ハート 6枚入り 公式フォトカード入り マスクに貼る 韓流 韓国ドラマ 愛の不時着 ヒョンビン ソン・イェジン,送料無料 愛の不時着 天然アロマ マスクシール マスクパッチ ハート 6枚入り 公式フォトカード入り マスクに貼る 韓流 韓国ドラマ　話題沸騰　3セット ヒョンビン ソン・イェジン,https://thumbnail.image.rakuten.co.jp/@0_mall/manwa/cabinet/07301774/interior/08613309/vg0019-1.jpg?_ex=128x128,,,1580.0,https://item.rakuten.co.jp/manwa/vg0019wt00/
【訳あり】[ 天然アロマ 選べる2種の香り ]フレーバーライフ SLEEPSTEP アロマティックバスミルク 200mL 入浴剤 安眠 快眠 リラックス ラベンダー ベルガモット Flavor Life【あす楽】,撮影のためシュリンク剥がれ,https://thumbnail.image.rakuten.co.jp/@0_mall/netsbee/cabinet/flavorlife/flavorlife057.jpg?_ex=128x128,,,2474.0,https://item.rakuten.co.jp/netsbee/gerira-flavorlife057/
【最大15%OFFクーポン】クスハンドメイド（KUSU HANDMADE）　天然アロマ防虫剤 カンフル＆ラベンダー 引き出し・衣装ケース用 10g×3包入り / 樟脳 しょうのう 衣替え クスノキ 楠 ラベンダー 衣類 洋服 服 タンス 衣装ケース,タンスや衣装ケースの中の大切なお洋服を守る、クスノキの天然樟脳。,https://thumbnail.image.rakuten.co.jp/@0_mall/aimere/cabinet/02050169/04999376/imgrc0083637617.jpg?_ex=128x128,,,1320.0,https://item.rakuten.co.jp/aimere/k0210032/
【最大15%OFFクーポン】クスハンドメイド（KUSU HANDMADE）　天然アロマ防虫剤 カンフル＆ラベンダー クローゼット用 10g×3包入り / 樟脳 しょうのう 衣替え クスノキ 楠 ラベンダー 衣類 洋服 服 クローゼット,クローゼットの中の大切なお洋服をやさしく守る、クスノキの天然樟脳。,https://thumbnail.image.rakuten.co.jp/@0_mall/aimere/cabinet/02050169/04999376/imgrc0083634454.jpg?_ex=128x128,,,1650.0,https://item.rakuten.co.jp/aimere/k0210033/
100％天然アロマ 歯茎のマッサージオイル【10ml】犬 デンタルケア【アロマオイル】【犬 無添加 アロマ 犬用 犬用品 オーラルケア ハグキ ペット ドッグ】,歯茎マッサージで健康で強い歯茎に！【犬　アロマ　デンタルケア】,https://thumbnail.image.rakuten.co.jp/@0_gold/ashudog/img/item/aroma-ha-img1.jpg?_ex=128x128,,,2950.0,https://item.rakuten.co.jp/ashudog/aroma0025/
【最大15%OFFクーポン】生活の木 空間消臭アロマ ハウスアロマ 10ml 天然 エッセンシャルオイル 天然アロマ 消臭オイル アロマオイル 消臭効果 オレンジハーブ シトラスミント フローラル ハーバルグリーン 玄関 リビング,生活空間に漂う悪臭を軽減し、心地よい香りに。生活の木 空間消臭アロマ ハウスアロマ 10ml 天然 エッセンシャルオイル オレンジハーブ シトラスミント フローラル ハーバルグリーン,https://thumbnail.image.rakuten.co.jp/@0_mall/aimere/cabinet/00276351/imgrc0120288753.jpg?_ex=128x128,,,1650.0,https://item.rakuten.co.jp/aimere/s0070219/
入浴剤 ひのき「 STYLE JAPAN ジャパニーズスパ 」【ひのき風呂 ヒノキ風呂 天然アロマ お風呂 入浴剤 桧 檜 くず チップ 土佐龍 ひのきチップ】,四万十ひのきの入浴剤です。【天然素材 安全 ひのきチップ 日本製 母の日 父の日 敬老の日 ギフト プチギフト】,https://thumbnail.image.rakuten.co.jp/@0_mall/safetyservice/cabinet/item05/1063-sjhjs-001.jpg?_ex=128x128,,,715.0,https://item.rakuten.co.jp/safetyservice/1063-sjhjs/
「 STYLE JAPAN くすのきシューキーパー 」【靴 消臭 下駄箱 シューズ ケア 脱臭 天然アロマ 楠 衣替え】,靴を休める時に。靴の形を整えながら消臭します。【天然素材 安全 くすのきチップ 日本製】,https://thumbnail.image.rakuten.co.jp/@0_mall/safetyservice/cabinet/item05/1063-sjksk-001.jpg?_ex=128x128,,,1980.0,https://item.rakuten.co.jp/safetyservice/1063-sjksk/
【通常価格から16%OFF】 天然アロマ トイレ 消臭スプレー T-aroma ティーアロマ 2点セット(15ml＋100ml) | 携帯用 芳香剤 消臭剤 消臭 スプレー 瞬間消臭 強力消臭 トイレ用消臭スプレー 消臭ミスト おしゃれ 除菌 除菌スプレー 抗菌 抗菌スプレー アロミックスタイル,アロマスプレー 香り トイレの消臭スプレー 携帯 芳香剤・消臭剤 トイレ用 アルコール除菌 においケア インテリア レモングラス ハーブ ミント レモン アロマスター aromic style,https://thumbnail.image.rakuten.co.jp/@0_mall/aromaspray/cabinet/item/sp-taroma15-100-tn.jpg?_ex=128x128,,,1690.0,https://item.rakuten.co.jp/aromaspray/sp-taroma-100-15/
アンナトゥモール モイストヘアシャンプー 300ml + ヘアコンディショナー 300ml セット 無添加 植物オイル 100%自然由来 フケ カユミ 枝毛 切れ毛 弱酸性 シリコンフリー ナチュラル モイスト ダメージ補修 天然アロマ,anna tumoru 頭皮×艶髪ケア ベタイン 無添加 赤紫蘇エキス,https://thumbnail.image.rakuten.co.jp/@0_mall/luastyle/cabinet/bb/item26/imgrc0075342479.jpg?_ex=128x128,,,5720.0,https://item.rakuten.co.jp/luastyle/266970-928set/
【在庫限り】Beauwell アンドグッドナイト ゆったりバスソルトL 大容量 天然アロマ 入浴剤 スリーピーラベンダー 計量スプーン付 バスタイム バスグッズ リラックス 快眠グッズ,ビューウェルのゆったりバスソルトL 精油100%の天然アロマ入浴料！,https://thumbnail.image.rakuten.co.jp/@0_mall/eisei/cabinet/08432647/imgrc0122439531.jpg?_ex=128x128,,,1780.0,https://item.rakuten.co.jp/eisei/281500080/
100％天然アロマ除菌・消臭スプレー詰め替え用【500ml】【アロマスプレー】スプレータイプ 消臭剤 犬のトイレ【ペット用品 ペットグッズ ペット用 帝塚山ハウンドカム 楽天市場店 犬用 グッズ アロマオイル わんこ 愛犬 犬用品】【a0255】,安全の天然成分で除菌・消臭＋心安らぐいい香り♪【アロマスプレー】,https://thumbnail.image.rakuten.co.jp/@0_mall/catfood/cabinet/thumb_on3/aroma0021_th_on.jpg?_ex=128x128,,,5350.0,https://item.rakuten.co.jp/catfood/aroma0021/
【500円OFFクーポン配布中】 シンデレラタイム ブースターセラム ナノクレンジングゲル 敏感肌 310ml 1本 クレンジング W洗顔 天然アロマ アロマ ゲル クレンジングジェル ジェル,翌日配達 送料無料,https://thumbnail.image.rakuten.co.jp/@0_mall/keyroom-hida/cabinet/07849994/compass1618225236.jpg?_ex=128x128,,,2193.0,https://item.rakuten.co.jp/keyroom-hida/keyroom-10000249/
アンナトゥモール シャンプー モイストヘアシャンプー 300ml 無添加 植物オイル 100%自然由来 フケ カユミ 枝毛 切れ毛 弱酸性 シリコンフリー ナチュラル モイスト ダメージ補修 天然アロマ,anna tumoru 頭皮×艶髪ケア ベタイン 無添加 赤紫蘇エキス,https://thumbnail.image.rakuten.co.jp/@0_mall/luastyle/cabinet/bb/item26/imgrc0073460082.jpg?_ex=128x128,,,2970.0,https://item.rakuten.co.jp/luastyle/266970-928/
【20％OFF！＆ポイント5倍 お買い物マラソン】sVEAS スクアレントリートメント アミノ酸系 スカルプケア 頭皮ケア 年齢髪 ノンシリコン エイジングケア 天然アロマ ボタニカル 無添加 敏感肌 スクワレン トコトリエノール スクワラン ヘアパック ハリ ツヤ コシ サラ 大容量,美しい髪は健康な頭皮からエスヴィアス,https://thumbnail.image.rakuten.co.jp/@0_mall/sveas/cabinet/01/compass1669358751.jpg?_ex=128x128,,,4480.0,https://item.rakuten.co.jp/sveas/t-01fashionsale/
【香りが選べる2本セット】天然アロマ マスクスプレー マスクフレッシュ 2点セット(100ml×2) | アンチウイルス リラックス 天然 アロマ スプレー 精油 柑橘 マスク用 消臭 消臭スプレー 除菌 抗菌 リフレッシュ ギフト プレゼント プチギフト アロミックスタイル,アロママスクスプレー マスク ミスト 癒し レモン グレープフルーツ ベルガモット ペパーミント ユーカリ ティートリー オレンジ ラベンダー mask fresh アロマスター aromic style,https://thumbnail.image.rakuten.co.jp/@0_mall/aromaspray/cabinet/item/sp-mask-100x2-01n.jpg?_ex=128x128,,,1580.0,https://item.rakuten.co.jp/aromaspray/sp-mask01_adv/
【最大15%OFFクーポン】ラカスタ (LaCASTA) アロマエステ スタイリングジェル ストレート 120ml │ くせ毛 うねり オーガニック 天然アロマ ヘアジェル ヘアトリートメント トリートメント ツヤ髪 ヘアセット 時短 植物成分,うねり・くせ毛を解決！お出かけ前のスタイリングに,https://thumbnail.image.rakuten.co.jp/@0_mall/aimere/cabinet/02716961/05141361/imgrc0086317348.jpg?_ex=128x128,,,1980.0,https://item.rakuten.co.jp/aimere/l0180089/
メイドオブオーガニクス ファブリック スプレー ダニオフ 300mL 日本国内正規品 【 あす楽 】 【 ダニ ダニ対策 アロマスプレー ルームスプレー ファブリックスプレー オーガニック 天然アロマ 天然精油 アロマ 精油 天然成分 子供 ペット 安心 安全 】,メイドオブオーガニクス ダニ対策 ダニ避け アロマスプレー 精油 アロマ ルームスプレー ファブリックスプレー オーガニック 天然アロマ 天然精油 天然成分 子供 ペット 安心 安全,https://thumbnail.image.rakuten.co.jp/@0_mall/enciel/cabinet/033imgs/aena000100110162.jpg?_ex=128x128,,,1980.0,https://item.rakuten.co.jp/enciel/aena000100110162/
【期間限定20％OFF】ROOT FOUR ルートフォー 麻炭香パロサントの香り 20個入り 国産 野州麻 天然アロマ 自然の香り ヨガ 空間浄化 空調 たいまつ 瞑想 リラックス 邪気を払う,希少な野州麻を使用した炭香 心落ち着く自然の香り,https://thumbnail.image.rakuten.co.jp/@0_mall/wagamama-cafe/cabinet/biiino/item/s-image/kun047-1.jpg?_ex=128x128,,,3080.0,https://item.rakuten.co.jp/wagamama-cafe/kun047/
空気清浄機専用アロマソリューション 天然アロマ 選べる6つの香り アップル グレープフルーツ ローズ フレッシュホワイトムスク ラベンダー ベルガモット セルバ L S ティムバ ［あす楽］,空気清浄機専用・天然アロマの香りで癒しの空間を演出,https://thumbnail.image.rakuten.co.jp/@0_mall/onko/cabinet/07278472/07278481/imgrc0077983393.jpg?_ex=128x128,,,1551.0,https://item.rakuten.co.jp/onko/10003722/
