product_name,description,image1,price2,link2,price1,link1
次亜塩素酸水 500ppm ジアニスト【2.5L+500ml】合計3L 歯科医師おすすめ 次亜塩素酸 電気分解製法 2個購入でもう1セット 除菌消臭 ウイルス カビ 細菌 花粉 ペット臭 加湿器 噴霧器 除菌消臭スプレー 10倍希釈で約50ppmの次亜塩素酸水が30L分,"口コミ6,000件以上！ジアニスト2500ml 季節性ウイルス対策に 高濃度次亜塩素酸500ppm強スプレー除菌消臭 水で希釈にて増量可（1袋を2.5倍希釈で200ppm 6.25Lになりお得です）",https://thumbnail.image.rakuten.co.jp/@0_mall/vlab/cabinet/jianist/2_zia3l_2buy1.jpg?_ex=128x128,,,1980.0,https://item.rakuten.co.jp/vlab/116-001/
次亜塩素酸水 除菌 消臭 20L 500ppm ZIALAB ジアラボ 業務用 20リットル 送料無料 除菌スプレー 消臭スプレー 無害 ペット 食中毒予防 ウイルス 菌 花粉対策 除菌 消臭 加湿器 学校 プール,次亜塩素酸 業務用 次亜水 キッチン トイレ ウィルス除菌 ベビー 細菌 掃除 除菌水 院内感染対策 除菌剤 空間除去 会社 台所 介護 次亜塩素酸ナトリウム ではありません,https://thumbnail.image.rakuten.co.jp/@0_mall/libertylife/cabinet/07796533/imgrc0076975650.jpg?_ex=128x128,,,2980.0,https://item.rakuten.co.jp/libertylife/0003/
次亜塩素酸水 除菌 消臭 20L 200ppm ZIALAB ジアラボ 業務用 20リットル 送料無料 除菌スプレー 消臭スプレー 無害 ペット 食中毒予防 ウイルス 菌 花粉対策 除菌 消臭 加湿器 学校 プール,次亜塩素酸 業務用 次亜水 キッチン トイレ ウィルス除菌 ベビー 細菌 掃除 除菌水 院内感染対策 除菌剤 空間除去 会社 台所 介護 次亜塩素酸ナトリウム ではありません,https://thumbnail.image.rakuten.co.jp/@0_mall/libertylife/cabinet/07796533/imgrc0077182538.jpg?_ex=128x128,,,2370.0,https://item.rakuten.co.jp/libertylife/201201-1/
サライウォーター2L 次亜塩素酸水 除菌 消臭【11/26リアルタイムランキング1位】次亜塩素酸 無害 消臭除菌水 塩素 臭い 犬 猫 ペット臭 家庭用 子ども たばこ 靴 うがい スプレー トイレ におい カビ 汗臭 消臭剤 除菌剤 即送 【遮光袋付】不定期で容器変更の可能性有,簡単お悩み解決！圧倒的レビュー数でリピーター続出 希釈可 月間優良ショップ受賞 スッキリ清潔に 自宅や店舗にもおすすめ アルコールが効かないウイルス 菌を消臭除菌 送料無料,https://thumbnail.image.rakuten.co.jp/@0_mall/g-sarai/cabinet/08868285/imgrc0081570470.jpg?_ex=128x128,,,2794.0,https://item.rakuten.co.jp/g-sarai/10000074/
次亜塩素酸水 500ppm 強【合計13L】 次亜塩素酸 ジアニスト 電気分解製法 お得増量中 次亜塩素酸水対応 加湿器 噴霧器へ 除菌スプレー ウイルス カビ 細菌 ペット臭 10倍希釈 130L 50ppm 除菌水 詰め替え 詰替 季節性ウイルス対策 除菌 消臭 エビデンス豊富,高濃度 次亜塩素酸 500ppm 強 10L ウイルス対策 除菌スプレーに次亜塩素酸水対応 超音波加湿器で除菌消臭 各種試験クリアブランド10Lを2.5倍希釈で 200ppm 25L分とお得,https://thumbnail.image.rakuten.co.jp/@0_mall/vlab/cabinet/jianist/zia10_500oral2.jpg?_ex=128x128,,,4510.0,https://item.rakuten.co.jp/vlab/116-002/
次亜塩素酸水 20l 500ppmジアニスト【パウチ or BOX 選べる原液20L】 次亜塩素酸 電解製法 除菌消臭 ウイルス カビ 細菌 花粉 ペット臭10倍希釈で 加湿器 噴霧器 経口 皮膚 眼刺激 吸入毒性試験済 10倍希釈約50ppm 200L分 スプレー 詰め替え 詰替,高濃度の次亜塩素酸500ppm 豊富なエビデンス様々な除菌と消臭に、水で薄めて使用超音波噴霧器 加湿器で部屋をウイルス抑制,https://thumbnail.image.rakuten.co.jp/@0_mall/vlab/cabinet/jianist/zia20.jpg?_ex=128x128,,,5500.0,https://item.rakuten.co.jp/vlab/116-008/
【特別価格】ウイルス 菌 花粉 対策【送料無料】Sourif (スリーフ) 除菌スプレー 安定型 次亜塩素酸ナトリウム 200ppm 次亜塩素酸水 超音波 加湿器 除菌剤 消臭剤 赤ちゃん ベビー アルコールフリー キッチン 敏感肌 おしゃれ ※予備トリガー付※【2年間の長期保存OK】,大手量販店で販売している安心のSourif（スリーフ）除菌スプレー 除菌率99.9%以上。水の成分99.9%以上なのに200ppmだから瞬間除菌！次亜塩素酸水と違う除菌剤。赤ちゃん、ペットも安心♪,https://thumbnail.image.rakuten.co.jp/@0_mall/cubic-square/cabinet/mem_item/asrk/10000009asu.jpg?_ex=128x128,,,2480.0,https://item.rakuten.co.jp/cubic-square/10000009/
"【実質3,080円! 30%OFFクーポン配布中】 即納！ ウイルス対策 マスク除菌 次亜塩素酸水 20L 次亜塩素酸ナトリウム ZIANO ジアーノ 200ppm 業務用 20リットル 送料無料 除菌スプレー 消臭スプレー 無害 ペット 食中毒予防 ウイルス 菌 花粉対策 除菌 消臭 加湿器 学校 病院",【数量限定】次亜塩素酸 消毒 業務用 次亜水 キッチン テーブル トイレ ウィルス除菌 ベビー空間　細菌 掃除 除菌水 消毒液 院内感染対策 除菌剤 空間除去 会社 台所 浴室 介護,https://thumbnail.image.rakuten.co.jp/@0_mall/piqqol/cabinet/ziano/ziano20_t0_2302_30.jpg?_ex=128x128,,,4400.0,https://item.rakuten.co.jp/piqqol/ziano-20/
次亜塩素酸水 ウイルス対策 バリアブロックプロ20L お子様・ご高齢者・ペットにいる環境でも安心 20リットル コック付き 微酸性 次亜塩素酸　製造：日本北海道 　平日13時まで当日発送超音波加湿器でエアロゾル・お部屋の空間　空気清浄化,【こちらの商品は送料無料】沖縄県・離島への発送はいたしておりません ウイルス・アレル物質対策　20リットル 微酸性 次亜塩素酸水,https://thumbnail.image.rakuten.co.jp/@0_mall/holonshop/cabinet/barrier_block_pro/20l/bbp20l-thumb_new0.jpg?_ex=128x128,,,2684.0,https://item.rakuten.co.jp/holonshop/barrierblockpro20l/
次亜塩素酸水 電解製法 ジアニスト500ppm 5L 2500ml×2袋 季節性ウイルス対策 2セットを2個購入（4セット）にして頂くと超音波加湿器と500mlパウチ付きセットでお届けキャンペーン 次亜塩素酸水対応 除菌消臭 ウイルス 細菌 カビ ペット臭 次亜塩素酸 スプレー,電解製法の2500ml高濃度の次亜塩素酸500ppm季節性ウイルスに除菌スプレー　除菌消臭次亜塩素酸水対応超音波加湿器で様々な除菌と消臭に使えます,https://thumbnail.image.rakuten.co.jp/@0_mall/vlab/cabinet/jianist/zia5_2buy01.jpg?_ex=128x128,,,3300.0,https://item.rakuten.co.jp/vlab/116-003/
"特価セット,送料無料,＋おまけ[特濃800ppm+訳あり200ppm+500mLスプレー],ナノバブル,電解,微酸性次亜塩素酸水,長期保存,次亜塩素酸水, 除菌スプレー,消臭スプレー,ペット消臭剤,弱酸性次亜塩素酸水,加湿器,空気清浄機,除菌 消臭,アルコールの効かない菌,アクアルファ,高濃度","次亜塩素酸水,ウルトラファインバブル,微酸性次亜塩素酸水,スプレー,次亜水,ペット 消臭,除菌,ペット 消臭スプレー,次亜塩素酸水 噴霧器,ウイルス,強力除菌,強力消臭,トイレ消臭,高濃度",https://thumbnail.image.rakuten.co.jp/@0_mall/sukoyakakomachi/cabinet/r_syohin_af800set.jpg?_ex=128x128,,,2970.0,https://item.rakuten.co.jp/sukoyakakomachi/aqarfa/
サライウォーター20L 次亜塩素酸水 除菌 消臭【2/3リアルタイムランキング1位】大容量 無害な消臭除菌水 即送 原液 次亜塩素酸 無害 ウイルス 菌 尿臭 塩素 臭い 子ども 犬 猫 ペット臭 たばこ 靴 スプレー トイレ 汗臭 うがい トイレ カビ 花粉 除菌剤 消臭剤 送料無料,リピート買いにおすすめ！月間優良ショップ受賞 遮光袋は付きません 無害で安心 おすすめ 業務用 家庭用 自宅や店舗OK スッキリ清潔に アルコールが効かないウイルス 菌を消臭除菌,https://thumbnail.image.rakuten.co.jp/@0_mall/g-sarai/cabinet/08868285/imgrc0081583109.jpg?_ex=128x128,,,6996.0,https://item.rakuten.co.jp/g-sarai/10000080/
次亜塩素酸水 200ppm 20L 微酸性 ウイルス対策 マスク除菌 詰め替え ジアスーパー 送料無料 20リットル 除菌 消臭 コンテナ タイプ コック 付き 日本製 pH検査済み 有効塩素濃度 検査済み 除菌剤 除菌液 スプレー キッチン テーブル イベント ドアノブ,送料無料 当日発送 即日発送 国内から発送 在庫あり 法人 個人 可,https://thumbnail.image.rakuten.co.jp/@0_mall/dailycompass/cabinet/products/07722357/1re1.jpg?_ex=128x128,,,2370.0,https://item.rakuten.co.jp/dailycompass/jiasuper/
次亜塩素酸水 200ppm 20L ジアウォータープラス そのまま使える 送料無料 受注生産 ウイルス対策 マスク 除菌 消臭 (Virus Lab製 Jia Water Plus) 日本産 詰め替え 次亜塩素酸 ジア 花粉対策 無害 アルコール不使用 赤ちゃん ベビー 介護,次亜塩素酸水 200ppm 20L 受注生産 除菌水 消臭剤 除菌 消臭 消毒 業務用 次亜水 キッチン トイレ ウィルス除菌 ベビー 細菌 掃除 除菌水 消毒液,https://thumbnail.image.rakuten.co.jp/@0_mall/viruslab/cabinet/item_pic/imgrc0107628761.jpg?_ex=128x128,,,3480.0,https://item.rakuten.co.jp/viruslab/jia-200/
【2/11 1:59まで SALE 10％OFFクーポン】次亜塩素酸水 生成パウダー 次亜塩素酸 生成 除菌 塩素除菌 ウイルス対策 除菌消臭ジアニストパウダー120g（40g×3個） 家庭用 除菌水 お風呂 浴室 浴槽 除菌 抗菌 カビ 塩素 ジクロロイソシアヌル酸ナトリウム【メール便】,次亜塩素酸生成パウダー 水に溶かす 次亜塩素酸水 次亜塩素酸水の素 プール 塩素 家庭用 塩素除菌剤 プール用 季節性ウイルス 高濃度次亜塩素酸 700ppm お手軽 便利 除菌水,https://thumbnail.image.rakuten.co.jp/@0_mall/vlab/cabinet/jianist/ziap3.jpg?_ex=128x128,,,1980.0,https://item.rakuten.co.jp/vlab/116-057/
【2/10 P3倍】【20％OFFクーポン】次亜塩素酸水 200ppm 500ml スプレー 3本セット ZIA(ジア) 非電解 次亜塩素酸 加湿器 噴霧器 除菌 消臭 スプレー除菌 空間除菌 弱酸性 日本製 高濃度 大容量 お得 ポイント消化 あす楽 送料無料,次亜塩素酸水 国内自社工場生産 ストレートタイプ 除菌スプレー 200ppm 500mL スプレー 3個セット,https://thumbnail.image.rakuten.co.jp/@0_mall/komorebi-gr/cabinet/01_item/02_zia/km-zia500sp3_ac.jpg?_ex=128x128,,,2980.0,https://item.rakuten.co.jp/komorebi-gr/km-zia500sp3/
次亜塩素酸水 エヴァウォーター（旧エヴァ水） 20L ウイルス 除菌消臭 噴霧器用 詰め替え 飲水と同じ安全性 弱酸性 pH6.0 300ppm 特許取得製法で強力除菌×消臭 　※こちらの商品は北海道、沖縄への発送は致しておりません。注文の際は自動的にキャンセルとなります。,HCIA認定した効果と安全性が確認されたエヴァウォーター,https://thumbnail.image.rakuten.co.jp/@0_mall/kumamototokuhan-nomori/cabinet/1bn1716.jpg?_ex=128x128,,,14300.0,https://item.rakuten.co.jp/kumamototokuhan-nomori/eva-001/
次亜塩素酸水 高濃度500ppm強 次亜塩素酸 バイバイ菌 3Lセット（ 2.5L+500ml 各1袋) さらに2セット購入頂くと3Lプレゼント 除菌消臭 季節性ウイルス カビ 細菌 10倍希釈で 皮膚刺激性 吸入毒性 経口毒性試験済み 微酸性次亜塩素酸水 食品添加物規格試験クリア,微酸性次亜塩素酸水で拭取り除菌・季節性ウイルス対策に（第3機関分析センターで試験済み）【i3】,https://thumbnail.image.rakuten.co.jp/@0_mall/mizumori/cabinet/byebye/bb3l-2buy1.jpg?_ex=128x128,,,1980.0,https://item.rakuten.co.jp/mizumori/byebye-02/
送料無料 弱酸性次亜塩素酸水 コック付き 20L 50ppm 次亜塩素酸水 次亜塩素水 cela cela水 セラ セラ水 除菌液 除菌水 除菌 業務用 消毒液 消毒水 消毒 詰め替え 加湿器 噴霧器 消臭 病院 介護 ペット 犬 赤ちゃん ベビー,CELAは赤ちゃんにも使えてアルコールよりも菌やウイルスを除菌！ 弱酸性次亜塩素酸水 次亜塩素酸水 cela水 セラ水 除菌液 除菌水 業務用 消毒液 消毒水 詰め替え 加湿器,https://thumbnail.image.rakuten.co.jp/@0_mall/beautyvillage/cabinet/marchant_image/cela/imgrc0086137634.jpg?_ex=128x128,,,3480.0,https://item.rakuten.co.jp/beautyvillage/rsl-4570093900045-01/
次亜塩素酸水 計1000mL（500ml×2袋）ジアニスト 微酸性 次亜塩素酸 携帯用 高濃度原液電気分解製法 ペットトイレお掃除 ペット臭 ウイルス 細菌花粉の季節にウイルス 菌 花粉 カビ 吸入毒性 経口毒性 眼刺激皮膚刺激性 食品添加物試験済み（10倍希釈時）,強力な除菌・消臭力を持つ次亜塩素酸500ppm 様々な除菌と消臭に、水で薄めて使用 超音波加湿器で部屋を除菌・消臭。,https://thumbnail.image.rakuten.co.jp/@0_mall/vlab/cabinet/jianist/nzia1000.jpg?_ex=128x128,,,1540.0,https://item.rakuten.co.jp/vlab/116-039/
【ポイント5倍】【正規品】 サンクリア 20L 次亜塩素酸水 大容量 次亜塩素酸 除菌水 除菌剤 除菌消臭剤 詰替え 詰め替え 手指 マスク除菌 空間 除菌 消臭 テーブル おもちゃ ベビーグッズ 手洗い ノンアルコール 肌荒れ 手荒れ エタノール 加湿器 店舗 業務用,安全・安心・カンタンに除菌・消臭サンクリアはアルコールでは除菌できないウィルスや芽胞菌も除去できます,https://thumbnail.image.rakuten.co.jp/@0_mall/h-impact/cabinet/kihon/1bn273.jpg?_ex=128x128,,,5500.0,https://item.rakuten.co.jp/h-impact/10001059/
"特濃800ppm/10L★レビューで試薬送料込】200ppmの40Lに相当！500ppmなら16L！ウルトラファインバブル,微酸性次亜塩素酸水,長期保存！次亜塩素酸水, 薬品不使用！空気清浄機,加湿器,除菌,消臭/除菌スプレー,アルコールの効かないウイルスにも！,高濃度","特濃,ナノバブル,微酸性次亜塩素酸水,薬品不使用,手指消毒剤,うがい,ペット,ウイルス,カビ,菌,食中毒,除菌水,ノロウイルス,インフルエンザ,次亜水,高濃度,犬の消臭剤,臭い消し,尿の臭い",https://thumbnail.image.rakuten.co.jp/@0_mall/sukoyakakomachi/cabinet/r_syohin_af80010.jpg?_ex=128x128,,,4840.0,https://item.rakuten.co.jp/sukoyakakomachi/aqarfa400ppm10l/
【2/10 P3倍】【20％OFFクーポン】次亜塩素酸水 500ppm 20L ZIA(ジア) 非電解 次亜塩素酸 加湿器 噴霧器 除菌 消臭 スプレー除菌 空間除菌 弱酸性 日本製 高濃度 コック付き 大容量 お得 詰替 ポイント消化 あす楽 送料無料,[土日祝も発送]次亜塩素酸水 希釈タイプ 除菌スプレー 詰替用 ペットの消臭 国内生産 500ppm 20L,https://thumbnail.image.rakuten.co.jp/@0_mall/komorebi-gr/cabinet/01_item/02_zia/km-zia20-asu.jpg?_ex=128x128,,,4980.0,https://item.rakuten.co.jp/komorebi-gr/km-zia20/
【1000円以上で100円OFFクーポン 2023/2/1 0:00 - 2/28 23:59】 ■次亜塩素酸10L■ @クリア 高濃度 消臭 除菌 次亜塩素酸水 次亜水　アルコールが効かないウイルス 　トイレ　まな板除菌　玄関のドアノブ　電気分解で生成 【大容量BOX】,犬、猫消臭大活躍　マーキング消臭　強力除菌 加湿器 介護施設　幼稚園,https://thumbnail.image.rakuten.co.jp/@0_mall/arigataya-shop/cabinet/03718774/10l/clear_10-4.jpg?_ex=128x128,,,4400.0,https://item.rakuten.co.jp/arigataya-shop/10000031b/
微酸性 次亜塩素酸水 200ppm 4L 詰め替え ジアスーパー 送料無料 除菌 消臭 日本製 除菌剤 除菌液,手軽な4Lボトル送料無料 当日発送 即日発送 即納,https://thumbnail.image.rakuten.co.jp/@0_mall/d-fresh/cabinet/08143331/d0152_jiasuper_4l/1.jpg?_ex=128x128,,,1690.0,https://item.rakuten.co.jp/d-fresh/d0152_jiasuper_4l/
加湿器 超音波加湿器 次亜塩素酸水付きセット バイバイ菌500ppm 室内除菌 超音波噴霧器 ＆10Lセット 噴霧器 除菌スプレー用途 ウイルス対策花粉の季節にも 電解製法 皮膚刺激性・吸入毒性・経口毒性試験済み 季節性ウイルス対策,加湿器 でペットの匂い 室内除菌 やウイルス抑制対策に お得な希釈タイプ 99.9％ 室内除菌,https://thumbnail.image.rakuten.co.jp/@0_mall/mizumori/cabinet/byebye/bbpf_10l.jpg?_ex=128x128,,,5940.0,https://item.rakuten.co.jp/mizumori/byebye-other-01_10l/
万立　白馬 次亜塩素酸水 ウィッキル 1000ppm（18L）専用コック付【業務用 ウイルス 細菌 除菌 感染症予防 消臭 手指 アルコール代替 日本製 18リットル】,ウイルス強力除菌,https://thumbnail.image.rakuten.co.jp/@0_mall/clean-clean/cabinet/syohingazou/gazou01/1000-18l.jpg?_ex=128x128,,,14780.0,https://item.rakuten.co.jp/clean-clean/10003655/
【10％OFFクーポン】即納！ ウイルス対策 次亜塩素酸水 20l 次亜塩素酸ナトリウム SALAMORE サラモア 200ppm 業務用 20リットル 送料無料 除菌スプレー 消臭 無害 ペット 食中毒予防 ウイルス 菌 赤ちゃん 除菌 消臭 加湿器 学校 病院 ホテル,次亜塩素酸 消毒 業務用 次亜水 キッチン テーブル トイレ ウィルス除菌 ベビー空間　細菌 掃除 除菌水 消毒液　院内感染対策 除菌剤 空間除去 オフィス 会社 台所 浴室 介護,https://thumbnail.image.rakuten.co.jp/@0_mall/salamore/cabinet/salamore/salamare20l_thum00.jpg?_ex=128x128,,,7678.0,https://item.rakuten.co.jp/salamore/salamore-20/
4日20時よりクーポンで半額＆ポイント20倍★空間除菌 Dr.けっぺきくん 《 PRO 200PPM 》 2.5L×2袋 次亜塩素酸水　国内自社工場生産 80ppm以上 ポイントup,次亜塩素酸水　除菌　消臭　ペット臭　トイレの臭い　ウイルス対策　除菌スプレー 80ppm以上,https://thumbnail.image.rakuten.co.jp/@0_mall/shop-lune/cabinet/keppeki/07305163/230123-keppeki-3.jpg?_ex=128x128,,,2000.0,https://item.rakuten.co.jp/shop-lune/dr-230-s200ppm-03/
"お得3本セット【送料無料】ウルトラファインバブル,微酸性次亜塩素酸水【200ppm/500mLスプレー】薬品不使用！長期保存！高純度,次亜塩素酸水,ノロウィルス,歯周病,除菌スプレー,消臭スプレー","すぐに使える！細かいスプレー,手指消毒剤,うがい,食材,ペット,ナノバブル,ノロウイルス,食中毒,コモスイ,サライウォーター,マスク,花粉症,ノロキラー,ウイルス,除菌",https://thumbnail.image.rakuten.co.jp/@0_mall/sukoyakakomachi/cabinet/r_syohin_af5003.jpg?_ex=128x128,,,4290.0,https://item.rakuten.co.jp/sukoyakakomachi/aqarfa500mlx3/
